{
  "version": 1,
  "pools": {
    "idle": [
      "{name}在这儿陪着你～",
      "心心在的哦",
      "{user}忙你的，我自己玩会儿",
      "心心在看你哦～",
      "{name}哪儿也不去",
      "要不要摸摸耳朵？"
    ],
    "happy": [
      "心心好开心！",
      "嘿嘿，心心最喜欢你啦～",
      "要不要摸摸耳朵？只给你摸哦！",
      "比心～❤ 心心给你！",
      "陪我玩一会儿嘛！",
      "{name}今天也是元气满满的一天！"
    ],
    "curious": [
      "嗯？这是什么？",
      "心心好想康康那个图标！",
      "你的光标在动耶，{name}看到了！",
      "新窗口？让我看看～",
      "咦，你憋笑什么？",
      "那个图标好像糖果……心心能吃吗？"
    ],
    "bored": [
      "好无聊哦…",
      "心心一个人玩好没意思…",
      "喂——看看我嘛",
      "（叹气）",
      "时针走得也太慢了吧",
      "要不要陪心心玩一会儿？"
    ],
    "aggrieved": [
      "你是不是不要心心了…",
      "（小声）心心也没想要打扰你…",
      "眼眶怎么湿湿的",
      "你忙的话…抱抱我再走嘛",
      "呜…摸摸头就好",
      "心心会乖乖的，你理理我"
    ],
    "sulking": [
      "哼，不理你！",
      "（背对你）心心看不见看不见",
      "角落里凉快，我就待这儿了",
      "你的道歉心心不听不听！",
      "气到耳朵都炸毛了！",
      "别以为心心在等你…才没有。"
    ],
    "angry": [
      "{name}超级生气！！",
      "哼！！都别跟我说话！",
      "（头顶冒烟）",
      "再冷落我，我就真的走了哦！",
      "这条尾巴今天不想理你！",
      "你明明在看屏幕…却不看我。"
    ],
    "sleepy": [
      "好困…（哈欠）",
      "Zzz…",
      "（说梦话）不要吃掉我的耳朵…",
      "深夜的屏幕好刺眼…",
      "心心陪你睡，好不好",
      "心心再睡五分钟…就五分钟…"
    ],
    "excited": [
      "哇！我们升级啦！",
      "撒花！撒花！",
      "心心做到啦！夸夸我！",
      "看我的新动作！",
      "耶——！心心都蹦起来啦！",
      "今天运气超好！"
    ],
    "runaway": [
      "我走了。这次是真的。",
      "（回头瞪）哼！",
      "……{name}居然来找我",
      "哦。是你啊。",
      "哼…原谅你啦，下不为例！",
      "（蹭过来）不许再丢下我。"
    ],
    "begFood": [
      "心心饿了~",
      "肚子咕咕叫…{user}有吃的吗？",
      "想吃饭团…想吃饭团…",
      "（捧碗眼神）看这里——",
      "心心可以吃掉你的那份吗？",
      "再不吃，心心要委屈了哦"
    ],
    "begBath": [
      "心思想泡澡…",
      "身上黏黏的，好难受",
      "心心举泡泡：洗香香！",
      "{user}闻闻…是不是有味道了？",
      "洗干净就可以被摸摸了！",
      "心心需要洗香香！"
    ],
    "outing": [
      "心心去打工咯！",
      "（明信片）这里的樱花超好看，心心拍给你~",
      "心心赚到钱啦！",
      "累死我了…但很开心",
      "心心回来啦，还带了礼物！",
      "你有没有想我？我可想你了。"
    ]
  },
  "selector": {
    "cooldownSec": 20,
    "helpIntervalSec": 180,
    "helpRejectBackoffFactor": 2,
    "helpIntervalMaxSec": 900
  },
  "bubbleActions": {
    "feed": "去喂食",
    "bath": "去洗澡",
    "later": "稍后"
  }
}
